{
  "$schema": "https://json-schema.org/draft/2020-12/schema",
  "$id": "https://github.com/CatholicOS/cmddr/schema/genre.schema.json",
  "title": "CMDDR Genre",
  "description": "A document / speech TYPE in the Genre Registry (Table 1). Carries the genre's default register and its ceiling (maximum authority the issuer can exercise through it). Never fixes the authority of a particular passage.",
  "type": "object",
  "additionalProperties": false,
  "required": ["id", "label", "issuerTypes", "defaultScope", "defaultRegister", "ceiling"],
  "properties": {
    "id": {
      "type": "string",
      "pattern": "^[a-z0-9-]+$",
      "description": "Stable slug, e.g. 'encyclical', 'dogmatic-constitution'."
    },
    "label": { "type": "string" },
    "issuerTypes": {
      "type": "array",
      "minItems": 1,
      "items": { "enum": ["ecumenical-council", "pope", "bishop"] },
      "description": "Roles that can issue this genre. A document's issuerType must be one of these."
    },
    "defaultScope": { "enum": ["universal", "local"] },
    "defaultRegister": {
      "enum": ["extraordinary", "ordinary-universal", "authentic-ordinary"],
      "description": "Presumptive register of the genre absent any special act."
    },
    "ceiling": {
      "enum": ["extraordinary", "ordinary-universal", "authentic-ordinary"],
      "description": "Maximum register the issuer can exercise through this genre. No Assessment may exceed it."
    },
    "presumptiveWeight": {
      "type": "integer",
      "description": "Optional ordinal for ranking genres of equal issuer/ceiling by title (e.g. Dogmatic Constitution > Constitution > Decree > Declaration)."
    },
    "allowedCharacteristics": {
      "type": "array",
      "uniqueItems": true,
      "items": { "enum": ["apostolic-constitution", "dogmatic-definition", "in-forma-brevis", "motu-proprio"] },
      "description": "Characteristics a document of this genre may bear (document.characteristics). A genre without this field allows none. Mirrors how issuerTypes constrains document.issuerType."
    },
    "description": { "type": "string" }
  },
  "allOf": [
    {
      "description": "defaultRegister may not exceed ceiling (authentic-ordinary < ordinary-universal < extraordinary)",
      "if": { "properties": { "ceiling": { "const": "authentic-ordinary" } } },
      "then": { "properties": { "defaultRegister": { "const": "authentic-ordinary" } } }
    },
    {
      "if": { "properties": { "ceiling": { "const": "ordinary-universal" } } },
      "then": { "properties": { "defaultRegister": { "enum": ["authentic-ordinary", "ordinary-universal"] } } }
    }
  ]
}
