[
  { "id": "constitution", "label": "Constitution", "issuerTypes": ["ecumenical-council"], "defaultScope": "universal", "defaultRegister": "authentic-ordinary", "ceiling": "extraordinary", "presumptiveWeight": 3, "description": "The council's most solemn genre. May bear an optional descriptive title; non-definitive unless a definition is manifest." },
  { "id": "decree", "label": "Decree", "issuerTypes": ["ecumenical-council"], "defaultScope": "universal", "defaultRegister": "authentic-ordinary", "ceiling": "extraordinary", "presumptiveWeight": 2, "description": "May carry canons/anathemas that are definitions (e.g. Trent); assess per canon." },
  { "id": "declaration", "label": "Declaration", "issuerTypes": ["ecumenical-council"], "defaultScope": "universal", "defaultRegister": "authentic-ordinary", "ceiling": "extraordinary", "presumptiveWeight": 1, "description": "Lowest conciliar genre by presumptive weight." },
  { "id": "papal-bull", "label": "Papal Bull", "issuerTypes": ["pope"], "defaultScope": "universal", "defaultRegister": "authentic-ordinary", "ceiling": "extraordinary", "allowedCharacteristics": ["apostolic-constitution", "dogmatic-definition"], "description": "The most solemn sealed form of papal document (lead/wax seal, Latin bulla). May bear one or more non-exclusive characteristics." },
  { "id": "encyclical", "label": "Encyclical", "issuerTypes": ["pope"], "defaultScope": "universal", "defaultRegister": "authentic-ordinary", "ceiling": "ordinary-universal", "description": "Circular letter of the pope to the universal Church; can invoke the ordinary and universal magisterium." },
  { "id": "apostolic-exhortation", "label": "Apostolic Exhortation", "issuerTypes": ["pope"], "defaultScope": "universal", "defaultRegister": "authentic-ordinary", "ceiling": "authentic-ordinary", "description": "Typically post-synodal, hortatory." },
  { "id": "apostolic-letter", "label": "Apostolic Letter", "issuerTypes": ["pope"], "defaultScope": "universal", "defaultRegister": "authentic-ordinary", "ceiling": "ordinary-universal", "allowedCharacteristics": ["motu-proprio"], "description": "Formal papal act in the pope's own name (Litterae Apostolicae): Latin incipit, entered in the acts, juridical effect. Spans universal teaching (e.g. Ordinatio Sacerdotalis) and local governance (erecting dioceses, proclaiming patrons); scope is read per document." },
  { "id": "brief", "label": "Brief", "issuerTypes": ["pope"], "defaultScope": "universal", "defaultRegister": "authentic-ordinary", "ceiling": "authentic-ordinary", "description": "Less formal papal letter." },
  { "id": "letter", "label": "Letter", "issuerTypes": ["pope"], "defaultScope": "local", "defaultRegister": "authentic-ordinary", "ceiling": "authentic-ordinary", "description": "Ordinary papal correspondence (Epistula) to a named person or body on an occasion, with no formal instrument behind it; titled by addressee and occasion, not by incipit. Differs from the Apostolic Letter by form, not by audience or weight; weight is per statement, not per addressee." },
  { "id": "discourse-address", "label": "Discourse / Address", "issuerTypes": ["pope"], "defaultScope": "universal", "defaultRegister": "authentic-ordinary", "ceiling": "authentic-ordinary", "description": "Pastoral vehicle; cannot host a definition." },
  { "id": "homily", "label": "Homily", "issuerTypes": ["pope"], "defaultScope": "universal", "defaultRegister": "authentic-ordinary", "ceiling": "authentic-ordinary", "description": "Papal homily." },
  { "id": "prayer", "label": "Prayer", "issuerTypes": ["pope"], "defaultScope": "universal", "defaultRegister": "authentic-ordinary", "ceiling": "authentic-ordinary", "description": "Papal prayer." },
  { "id": "audience-catechesis", "label": "Audience / Catechesis", "issuerTypes": ["pope"], "defaultScope": "universal", "defaultRegister": "authentic-ordinary", "ceiling": "authentic-ordinary", "description": "Papal audience or catechesis." },
  { "id": "message", "label": "Message", "issuerTypes": ["pope"], "defaultScope": "universal", "defaultRegister": "authentic-ordinary", "ceiling": "authentic-ordinary", "description": "Covers both the annual World Day / Lent series and occasional messages to a congress, dicastery or body. Non-defining pastoral vehicle; sits beside Discourse, Homily and Audience." },
  { "id": "urbi-et-orbi", "label": "Urbi et Orbi", "issuerTypes": ["pope"], "defaultScope": "universal", "defaultRegister": "authentic-ordinary", "ceiling": "authentic-ordinary", "description": "The solemn papal blessing to the City and the World, with a plenary indulgence attached under the usual conditions (extended by the Apostolic Penitentiary to those receiving it by broadcast). The blessing is the act; only the accompanying address carries teaching, assessed per statement." },
  { "id": "episcopal-pastoral-letter", "label": "Episcopal / Pastoral Letter", "issuerTypes": ["bishop"], "defaultScope": "local", "defaultRegister": "authentic-ordinary", "ceiling": "authentic-ordinary", "description": "An individual bishop shares in the ordinary universal magisterium only collegially, not through a local act." },
  { "id": "episcopal-homily", "label": "Episcopal Homily", "issuerTypes": ["bishop"], "defaultScope": "local", "defaultRegister": "authentic-ordinary", "ceiling": "authentic-ordinary", "description": "Homily of an individual bishop." }
]
